{
  "batch_id": "T27_SALARIOS_CCAA_2024",
  "dedupe_note": "54 observaciones: España + 17 CCAA × 3 sexos; Ceuta y Melilla sin dato. Comparar semánticamente con otros indicadores salariales antes de publicar.",
  "new_indicators": [
    {
      "indicator_id": "EAES_SALARIO_ANUAL_BRUTO",
      "domain": "Economía",
      "subdomain": "Salarios",
      "label_es": "Ganancia media anual bruta por persona asalariada",
      "unit_default": "EUR/año",
      "source_id": "INE",
      "dataset_code": "EAES2024",
      "period_start": "2024",
      "period_end": "2024",
      "geography_scope": "España + 17 CCAA; Ceuta/Melilla no disponibles",
      "subgroup_dimensions": "Sexo: Ambos sexos / Mujeres / Hombres",
      "frequency": "anual",
      "quality_grade": "A",
      "status": "candidate_review",
      "methodology_note": "EAES 2024 definitiva, publicada 28/05/2026. Media no mediana; diferencias por sexo sin ajuste por jornada, ocupación o antigüedad."
    }
  ],
  "observations": [
    {
      "indicator_id": "EAES_SALARIO_ANUAL_BRUTO",
      "period": "2024",
      "geo_code": "ES",
      "geography": "España",
      "subgroup": "Ambos sexos",
      "value": 29540.26,
      "unit": "EUR/año",
      "source_locator": "EAES 2024, nota de prensa, tabla «Principales resultados por comunidades autónomas», p. 5/6",
      "methodology_flag": "EAES2024_FINAL_DESCRIPTIVE",
      "batch_id": "T27_SALARIOS_CCAA_2024",
      "source_id": "INE",
      "dataset_code": "EAES2024",
      "source_url": "https://www.ine.es/dyngs/Prensa/en/EAES2024.pdf",
      "source_updated": "2026-05-28",
      "retrieved_at": "2026-10-07",
      "quality_flag": "VERIFIED",
      "measurement_type": "survey",
      "limits": "Media salarial bruta anual por persona asalariada. Diferencias descriptivas; no equivalen a brecha ajustada ni demuestran discriminación. No se publican Ceuta y Melilla en la tabla de referencia."
    },
    {
      "indicator_id": "EAES_SALARIO_ANUAL_BRUTO",
      "period": "2024",
      "geo_code": "ES",
      "geography": "España",
      "subgroup": "Mujeres",
      "value": 26904.9,
      "unit": "EUR/año",
      "source_locator": "EAES 2024, nota de prensa, tabla «Principales resultados por comunidades autónomas», p. 5/6",
      "methodology_flag": "EAES2024_FINAL_DESCRIPTIVE",
      "batch_id": "T27_SALARIOS_CCAA_2024",
      "source_id": "INE",
      "dataset_code": "EAES2024",
      "source_url": "https://www.ine.es/dyngs/Prensa/en/EAES2024.pdf",
      "source_updated": "2026-05-28",
      "retrieved_at": "2026-10-07",
      "quality_flag": "VERIFIED",
      "measurement_type": "survey",
      "limits": "Media salarial bruta anual por persona asalariada. Diferencias descriptivas; no equivalen a brecha ajustada ni demuestran discriminación. No se publican Ceuta y Melilla en la tabla de referencia."
    },
    {
      "indicator_id": "EAES_SALARIO_ANUAL_BRUTO",
      "period": "2024",
      "geo_code": "ES",
      "geography": "España",
      "subgroup": "Hombres",
      "value": 32057.55,
      "unit": "EUR/año",
      "source_locator": "EAES 2024, nota de prensa, tabla «Principales resultados por comunidades autónomas», p. 5/6",
      "methodology_flag": "EAES2024_FINAL_DESCRIPTIVE",
      "batch_id": "T27_SALARIOS_CCAA_2024",
      "source_id": "INE",
      "dataset_code": "EAES2024",
      "source_url": "https://www.ine.es/dyngs/Prensa/en/EAES2024.pdf",
      "source_updated": "2026-05-28",
      "retrieved_at": "2026-10-07",
      "quality_flag": "VERIFIED",
      "measurement_type": "survey",
      "limits": "Media salarial bruta anual por persona asalariada. Diferencias descriptivas; no equivalen a brecha ajustada ni demuestran discriminación. No se publican Ceuta y Melilla en la tabla de referencia."
    },
    {
      "indicator_id": "EAES_SALARIO_ANUAL_BRUTO",
      "period": "2024",
      "geo_code": "ES61",
      "geography": "Andalucía",
      "subgroup": "Ambos sexos",
      "value": 26089.7,
      "unit": "EUR/año",
      "source_locator": "EAES 2024, nota de prensa, tabla «Principales resultados por comunidades autónomas», p. 5/6",
      "methodology_flag": "EAES2024_FINAL_DESCRIPTIVE",
      "batch_id": "T27_SALARIOS_CCAA_2024",
      "source_id": "INE",
      "dataset_code": "EAES2024",
      "source_url": "https://www.ine.es/dyngs/Prensa/en/EAES2024.pdf",
      "source_updated": "2026-05-28",
      "retrieved_at": "2026-10-07",
      "quality_flag": "VERIFIED",
      "measurement_type": "survey",
      "limits": "Media salarial bruta anual por persona asalariada. Diferencias descriptivas; no equivalen a brecha ajustada ni demuestran discriminación. No se publican Ceuta y Melilla en la tabla de referencia."
    },
    {
      "indicator_id": "EAES_SALARIO_ANUAL_BRUTO",
      "period": "2024",
      "geo_code": "ES61",
      "geography": "Andalucía",
      "subgroup": "Mujeres",
      "value": 23679.2,
      "unit": "EUR/año",
      "source_locator": "EAES 2024, nota de prensa, tabla «Principales resultados por comunidades autónomas», p. 5/6",
      "methodology_flag": "EAES2024_FINAL_DESCRIPTIVE",
      "batch_id": "T27_SALARIOS_CCAA_2024",
      "source_id": "INE",
      "dataset_code": "EAES2024",
      "source_url": "https://www.ine.es/dyngs/Prensa/en/EAES2024.pdf",
      "source_updated": "2026-05-28",
      "retrieved_at": "2026-10-07",
      "quality_flag": "VERIFIED",
      "measurement_type": "survey",
      "limits": "Media salarial bruta anual por persona asalariada. Diferencias descriptivas; no equivalen a brecha ajustada ni demuestran discriminación. No se publican Ceuta y Melilla en la tabla de referencia."
    },
    {
      "indicator_id": "EAES_SALARIO_ANUAL_BRUTO",
      "period": "2024",
      "geo_code": "ES61",
      "geography": "Andalucía",
      "subgroup": "Hombres",
      "value": 28295.53,
      "unit": "EUR/año",
      "source_locator": "EAES 2024, nota de prensa, tabla «Principales resultados por comunidades autónomas», p. 5/6",
      "methodology_flag": "EAES2024_FINAL_DESCRIPTIVE",
      "batch_id": "T27_SALARIOS_CCAA_2024",
      "source_id": "INE",
      "dataset_code": "EAES2024",
      "source_url": "https://www.ine.es/dyngs/Prensa/en/EAES2024.pdf",
      "source_updated": "2026-05-28",
      "retrieved_at": "2026-10-07",
      "quality_flag": "VERIFIED",
      "measurement_type": "survey",
      "limits": "Media salarial bruta anual por persona asalariada. Diferencias descriptivas; no equivalen a brecha ajustada ni demuestran discriminación. No se publican Ceuta y Melilla en la tabla de referencia."
    },
    {
      "indicator_id": "EAES_SALARIO_ANUAL_BRUTO",
      "period": "2024",
      "geo_code": "ES24",
      "geography": "Aragón",
      "subgroup": "Ambos sexos",
      "value": 28061.94,
      "unit": "EUR/año",
      "source_locator": "EAES 2024, nota de prensa, tabla «Principales resultados por comunidades autónomas», p. 5/6",
      "methodology_flag": "EAES2024_FINAL_DESCRIPTIVE",
      "batch_id": "T27_SALARIOS_CCAA_2024",
      "source_id": "INE",
      "dataset_code": "EAES2024",
      "source_url": "https://www.ine.es/dyngs/Prensa/en/EAES2024.pdf",
      "source_updated": "2026-05-28",
      "retrieved_at": "2026-10-07",
      "quality_flag": "VERIFIED",
      "measurement_type": "survey",
      "limits": "Media salarial bruta anual por persona asalariada. Diferencias descriptivas; no equivalen a brecha ajustada ni demuestran discriminación. No se publican Ceuta y Melilla en la tabla de referencia."
    },
    {
      "indicator_id": "EAES_SALARIO_ANUAL_BRUTO",
      "period": "2024",
      "geo_code": "ES24",
      "geography": "Aragón",
      "subgroup": "Mujeres",
      "value": 24796.94,
      "unit": "EUR/año",
      "source_locator": "EAES 2024, nota de prensa, tabla «Principales resultados por comunidades autónomas», p. 5/6",
      "methodology_flag": "EAES2024_FINAL_DESCRIPTIVE",
      "batch_id": "T27_SALARIOS_CCAA_2024",
      "source_id": "INE",
      "dataset_code": "EAES2024",
      "source_url": "https://www.ine.es/dyngs/Prensa/en/EAES2024.pdf",
      "source_updated": "2026-05-28",
      "retrieved_at": "2026-10-07",
      "quality_flag": "VERIFIED",
      "measurement_type": "survey",
      "limits": "Media salarial bruta anual por persona asalariada. Diferencias descriptivas; no equivalen a brecha ajustada ni demuestran discriminación. No se publican Ceuta y Melilla en la tabla de referencia."
    },
    {
      "indicator_id": "EAES_SALARIO_ANUAL_BRUTO",
      "period": "2024",
      "geo_code": "ES24",
      "geography": "Aragón",
      "subgroup": "Hombres",
      "value": 31123.18,
      "unit": "EUR/año",
      "source_locator": "EAES 2024, nota de prensa, tabla «Principales resultados por comunidades autónomas», p. 5/6",
      "methodology_flag": "EAES2024_FINAL_DESCRIPTIVE",
      "batch_id": "T27_SALARIOS_CCAA_2024",
      "source_id": "INE",
      "dataset_code": "EAES2024",
      "source_url": "https://www.ine.es/dyngs/Prensa/en/EAES2024.pdf",
      "source_updated": "2026-05-28",
      "retrieved_at": "2026-10-07",
      "quality_flag": "VERIFIED",
      "measurement_type": "survey",
      "limits": "Media salarial bruta anual por persona asalariada. Diferencias descriptivas; no equivalen a brecha ajustada ni demuestran discriminación. No se publican Ceuta y Melilla en la tabla de referencia."
    },
    {
      "indicator_id": "EAES_SALARIO_ANUAL_BRUTO",
      "period": "2024",
      "geo_code": "ES12",
      "geography": "Asturias",
      "subgroup": "Ambos sexos",
      "value": 28562.31,
      "unit": "EUR/año",
      "source_locator": "EAES 2024, nota de prensa, tabla «Principales resultados por comunidades autónomas», p. 5/6",
      "methodology_flag": "EAES2024_FINAL_DESCRIPTIVE",
      "batch_id": "T27_SALARIOS_CCAA_2024",
      "source_id": "INE",
      "dataset_code": "EAES2024",
      "source_url": "https://www.ine.es/dyngs/Prensa/en/EAES2024.pdf",
      "source_updated": "2026-05-28",